{"small_version":"2.0.0","project_id":"project_a89af76cb6a8d3fb5d3e29ac22a0c35d","lineage_id":"lineage_1ae9a2104e6dbeaa037eef39d97d39d2","session_id":"session_9f52191b16868ae8e23aa0353f49e415","label":"implementation","actor_label":"example maintainer","observed_frontier":"1ab2ed72f342d0dc6b3f4cbd05d53502a07fc46bcbd97e00fbc3a36037a374f4","tool_version":"v1.1.0","created_at":"2026-09-17T16:22:42.358059Z","digest":"cb9c615f31a395c06e98a99e9131f0a30e7ccb124ee478e4f5a5c4ec9a5a0660"}
