{"small_version":"2.0.0","project_id":"project_a89af76cb6a8d3fb5d3e29ac22a0c35d","lineage_id":"lineage_1ae9a2104e6dbeaa037eef39d97d39d2","session_id":"session_fda04d5104f03fa727ae28354384c24b","label":"v1 migration","observed_frontier":"e3b0c44298fc1c149afbf4c8996fb92427ae41e4649b934ca495991b7852b855","tool_version":"small-migrate","created_at":"1970-01-01T00:00:00Z","digest":"b20f4878891a30cca41cbef8bbc4955228c6f9c4c654ae3f9a21deb4abb207fa"}
